{
  "$schema": "../schemas/evidence-manifest.schema.json",
  "schema_version": "1.0.0",
  "package_id": "BD-AF-P0P3-V1",
  "package_sha256": "REQUIRED_AT_EXECUTION",
  "task_id": "REQUIRED_AT_EXECUTION",
  "criterion_id": "REQUIRED_AT_EXECUTION",
  "baseline_commit": "REQUIRED_AT_EXECUTION",
  "actual_head": "REQUIRED_AT_EXECUTION",
  "worktree_clean": false,
  "argv": [],
  "execution_argv": [],
  "network_enforcer": "UNAVAILABLE_FAIL_CLOSED",
  "cwd": "REQUIRED_AT_EXECUTION",
  "network_policy": "DENIED",
  "timeout_seconds": 0,
  "started_at": "REQUIRED_AT_EXECUTION",
  "finished_at": "REQUIRED_AT_EXECUTION",
  "exit_code": 0,
  "stdout_sha256": "REQUIRED_AT_EXECUTION",
  "stderr_sha256": "REQUIRED_AT_EXECUTION",
  "junit": null,
  "artifact_sha256": {},
  "status": "NOT_VERIFIABLE",
  "failure_reason": "TEMPLATE_ONLY"
}
